candidate_domain,candidate_skills,candidate_years_experience,candidate_education,cv_text,job_domain,job_skills,job_years_required,job_description,relevance_score
Design UI/UX,Design Thinking;UX Writing;Illustrator;Tests utilisateurs;User Research;Design System;Accessibilité,2,Bac+5 (Master / Ingénieur),"Profil Design UI/UX avec 2 ans d'expérience. Diplôme : Bac+5 (Master / Ingénieur). A travaillé pendant 2 ans sur des projets liés à Design UI/UX, en mettant en œuvre Design Thinking, UX Writing, Illustrator, Tests utilisateurs, User Research, Design System, Accessibilité. Qualités personnelles : esprit critique, résolution de problèmes, autonomie.",Design UI/UX,InVision;User Research;After Effects;Accessibilité;Motion Design,5,"Poste ouvert dans le domaine Design UI/UX, 5 ans d'expérience minimum requis. Compétences requises : InVision, User Research, After Effects, Accessibilité, Motion Design. Le candidat idéal maîtrise ces technologies et outils dans un contexte Design UI/UX.",42.32
Gestion de Projet,PMP;Kanban;Roadmap produit;Product Owner;Jira;Gestion des risques,2,Bac+2 (BTS/DUT),"Molka, Bac+2 (BTS/DUT), 2 ans d'expérience dans le domaine Gestion de Projet. Compétences techniques maîtrisées : PMP, Kanban, Roadmap produit, Product Owner, Jira, Gestion des risques. Domaine principal : Gestion de Projet. Qualités personnelles : rigueur, leadership, adaptabilité.",DevOps / Cloud,Vagrant;Cloud Security;Jenkins;Monitoring;Networking;Docker,1,"Nous recherchons un profil DevOps / Cloud justifiant d'au moins 1 ans d'expérience. Compétences requises : Vagrant, Cloud Security, Jenkins, Monitoring, Networking, Docker. Le candidat idéal maîtrise ces technologies et outils dans un contexte DevOps / Cloud.",50.75
Développement Logiciel,SASS;MongoDB;Design Patterns;Spring Boot;Angular;TypeScript;Vue.js;JavaScript;Java;HTML,1,Bac+5 (Master / Ingénieur),"Karim - Bac+5 (Master / Ingénieur) - 1 années d'expérience professionnelle en Développement Logiciel. Compétences techniques maîtrisées : SASS, MongoDB, Design Patterns, Spring Boot, Angular, TypeScript, Vue.js, JavaScript, Java, HTML. Domaine principal : Développement Logiciel. Qualités personnelles : résolution de problèmes, autonomie, esprit d'équipe.",Réseaux / Systèmes,Windows Server;PowerShell;Linux;Virtualisation;Supervision réseau;VMware;Switching;DNS;Active Directory;Routage,7,"Nous recherchons un profil Réseaux / Systèmes justifiant d'au moins 7 ans d'expérience. Compétences requises : Windows Server, PowerShell, Linux, Virtualisation, Supervision réseau, VMware, Switching, DNS, Active Directory, Routage. Le candidat idéal maîtrise ces technologies et outils dans un contexte Réseaux / Systèmes.",10.27
Finance / Comptabilité,Gestion des risques financiers;Analyse financière;Audit financier;Reporting financier;Trésorerie;Power BI;SAP;IFRS;Comptabilité générale;Modélisation financière;Consolidation;Budgétisation,5,Bac+3 (Licence),"Molka - Bac+3 (Licence) - 5 années d'expérience professionnelle en Finance / Comptabilité. Expérience professionnelle de 5 ans incluant l'utilisation de Gestion des risques financiers, Analyse financière, Audit financier, Reporting financier, Trésorerie, Power BI, SAP, IFRS, Comptabilité générale, Modélisation financière, Consolidation, Budgétisation dans des projets Finance / Comptabilité. Qualités personnelles : créativité, leadership, rigueur.",Cybersécurité,ISO 27001;Cryptographie;Analyse de vulnérabilités;Forensics;OWASP,3,"Poste ouvert dans le domaine Cybersécurité, 3 ans d'expérience minimum requis. Compétences requises : ISO 27001, Cryptographie, Analyse de vulnérabilités, Forensics, OWASP. Le candidat idéal maîtrise ces technologies et outils dans un contexte Cybersécurité.",56.85
Gestion de Projet,Confluence;MS Project;Gestion des risques;Planification;PMP,0,Doctorat (PhD),"Profil Gestion de Projet avec 0 ans d'expérience. Diplôme : Doctorat (PhD). Expérience professionnelle de 0 ans incluant l'utilisation de Confluence, MS Project, Gestion des risques, Planification, PMP dans des projets Gestion de Projet. Qualités personnelles : sens de l'organisation, gestion du stress, adaptabilité.",Gestion de Projet,Scrum;Roadmap produit;Product Owner;PRINCE2;PMP;Jira;Gestion des risques;Kanban,7,"Offre d'emploi : spécialiste Gestion de Projet, expérience minimale de 7 ans. Compétences requises : Scrum, Roadmap produit, Product Owner, PRINCE2, PMP, Jira, Gestion des risques, Kanban. Le candidat idéal maîtrise ces technologies et outils dans un contexte Gestion de Projet.",13.02
Marketing Digital,Branding;SEO;Email Marketing;Réseaux sociaux;Facebook Ads;SEA;Google Analytics;Growth Hacking;Marketing Automation;Community Management;HubSpot,3,Bac+2 (BTS/DUT),"Farah - Bac+2 (BTS/DUT) - 3 années d'expérience professionnelle en Marketing Digital. Compétences techniques maîtrisées : Branding, SEO, Email Marketing, Réseaux sociaux, Facebook Ads, SEA, Google Analytics, Growth Hacking, Marketing Automation, Community Management, HubSpot. Domaine principal : Marketing Digital. Qualités personnelles : leadership, esprit d'équipe, adaptabilité.",Réseaux / Systèmes,Routage;DNS;Virtualisation;PowerShell;Sécurité réseau;Linux;Active Directory,7,"Poste ouvert dans le domaine Réseaux / Systèmes, 7 ans d'expérience minimum requis. Compétences requises : Routage, DNS, Virtualisation, PowerShell, Sécurité réseau, Linux, Active Directory. Le candidat idéal maîtrise ces technologies et outils dans un contexte Réseaux / Systèmes.",22.93
Réseaux / Systèmes,Routage;Virtualisation;DHCP;PowerShell;Windows Server;Cisco;Active Directory;Switching;DNS;Sécurité réseau;Linux;Supervision réseau,1,Bac+5 (Master / Ingénieur),"Sarra - Bac+5 (Master / Ingénieur) - 1 années d'expérience professionnelle en Réseaux / Systèmes. Expérience professionnelle de 1 ans incluant l'utilisation de Routage, Virtualisation, DHCP, PowerShell, Windows Server, Cisco, Active Directory, Switching, DNS, Sécurité réseau, Linux, Supervision réseau dans des projets Réseaux / Systèmes. Qualités personnelles : créativité, communication, esprit critique.",Réseaux / Systèmes,Routage;Switching;Cisco;Active Directory;Supervision réseau;DNS;Virtualisation;DHCP,3,"Offre d'emploi : spécialiste Réseaux / Systèmes, expérience minimale de 3 ans. Compétences requises : Routage, Switching, Cisco, Active Directory, Supervision réseau, DNS, Virtualisation, DHCP. Le candidat idéal maîtrise ces technologies et outils dans un contexte Réseaux / Systèmes.",66.1
DevOps / Cloud,Ansible;GCP;Prometheus;Bash;Terraform;Monitoring;Load Balancing;Cloud Security,3,Bac+3 (Licence),"Profil DevOps / Cloud avec 3 ans d'expérience. Diplôme : Bac+3 (Licence). A travaillé pendant 3 ans sur des projets liés à DevOps / Cloud, en mettant en œuvre Ansible, GCP, Prometheus, Bash, Terraform, Monitoring, Load Balancing, Cloud Security. Qualités personnelles : esprit d'équipe, résolution de problèmes, créativité.",DevOps / Cloud,Grafana;Ansible;GitLab CI;Terraform,0,"Poste ouvert dans le domaine DevOps / Cloud, 0 ans d'expérience minimum requis. Compétences requises : Grafana, Ansible, GitLab CI, Terraform. Le candidat idéal maîtrise ces technologies et outils dans un contexte DevOps / Cloud.",64.71
Gestion de Projet,Budget projet;Agile;Scrum;MS Project;Gestion des risques;Planification,9,Bac+5 (Master / Ingénieur),"Candidat motivé, 9 ans d'expérience en Gestion de Projet, Bac+5 (Master / Ingénieur). A travaillé pendant 9 ans sur des projets liés à Gestion de Projet, en mettant en œuvre Budget projet, Agile, Scrum, MS Project, Gestion des risques, Planification. Qualités personnelles : rigueur, curiosité, esprit critique.",Design UI/UX,Motion Design;UX Writing;Sketch;Wireframing;Photoshop;Tests utilisateurs,1,"Poste ouvert dans le domaine Design UI/UX, 1 ans d'expérience minimum requis. Compétences requises : Motion Design, UX Writing, Sketch, Wireframing, Photoshop, Tests utilisateurs. Le candidat idéal maîtrise ces technologies et outils dans un contexte Design UI/UX.",59.82
Cybersécurité,Forensics;OWASP;Audit de sécurité;SOC monitoring;Cryptographie;Gestion des risques;IAM;Sécurité réseau,4,Bac+3 (Licence),"Slim, Bac+3 (Licence), 4 ans d'expérience dans le domaine Cybersécurité. Expérience professionnelle de 4 ans incluant l'utilisation de Forensics, OWASP, Audit de sécurité, SOC monitoring, Cryptographie, Gestion des risques, IAM, Sécurité réseau dans des projets Cybersécurité. Qualités personnelles : autonomie, gestion du stress, leadership.",Cybersécurité,Sécurité réseau;Ethical Hacking;Forensics;SIEM;SOC;Wireshark;Pentest;Incident Response;Cryptographie,1,"Poste ouvert dans le domaine Cybersécurité, 1 ans d'expérience minimum requis. Compétences requises : Sécurité réseau, Ethical Hacking, Forensics, SIEM, SOC, Wireshark, Pentest, Incident Response, Cryptographie. Le candidat idéal maîtrise ces technologies et outils dans un contexte Cybersécurité.",70.01
Marketing Digital,Marketing Automation;Email Marketing;HubSpot;Content Marketing;Google Ads;CRM;SEO;Growth Hacking;Réseaux sociaux;SEA,9,Bac+2 (BTS/DUT),"Hamza - Bac+2 (BTS/DUT) - 9 années d'expérience professionnelle en Marketing Digital. Expérience professionnelle de 9 ans incluant l'utilisation de Marketing Automation, Email Marketing, HubSpot, Content Marketing, Google Ads, CRM, SEO, Growth Hacking, Réseaux sociaux, SEA dans des projets Marketing Digital. Qualités personnelles : autonomie, communication, gestion du stress.",Marketing Digital,Réseaux sociaux;Facebook Ads;SEA;Content Marketing;SEO;Google Ads;Copywriting,2,"Offre d'emploi : spécialiste Marketing Digital, expérience minimale de 2 ans. Compétences requises : Réseaux sociaux, Facebook Ads, SEA, Content Marketing, SEO, Google Ads, Copywriting. Le candidat idéal maîtrise ces technologies et outils dans un contexte Marketing Digital.",84.22
Marketing Digital,HubSpot;Email Marketing;Google Ads;Content Marketing;Growth Hacking;Copywriting;Community Management;CRM,7,Bac+5 (Master / Ingénieur),"Candidat motivé, 7 ans d'expérience en Marketing Digital, Bac+5 (Master / Ingénieur). A travaillé pendant 7 ans sur des projets liés à Marketing Digital, en mettant en œuvre HubSpot, Email Marketing, Google Ads, Content Marketing, Growth Hacking, Copywriting, Community Management, CRM. Qualités personnelles : rigueur, autonomie, esprit d'équipe.",Marketing Digital,Facebook Ads;Réseaux sociaux;Google Ads;Growth Hacking,3,"Poste ouvert dans le domaine Marketing Digital, 3 ans d'expérience minimum requis. Compétences requises : Facebook Ads, Réseaux sociaux, Google Ads, Growth Hacking. Le candidat idéal maîtrise ces technologies et outils dans un contexte Marketing Digital.",72.01
Data Science / Intelligence Artificielle,Power BI;Data Visualization;ETL;TensorFlow;PyTorch;A/B Testing;Big Data;Deep Learning;Pandas;Computer Vision;scikit-learn;Hadoop,0,Bac+2 (BTS/DUT),"Bilel - Bac+2 (BTS/DUT) - 0 années d'expérience professionnelle en Data Science / Intelligence Artificielle. Compétences techniques maîtrisées : Power BI, Data Visualization, ETL, TensorFlow, PyTorch, A/B Testing, Big Data, Deep Learning, Pandas, Computer Vision, scikit-learn, Hadoop. Domaine principal : Data Science / Intelligence Artificielle. Qualités personnelles : esprit critique, créativité, rigueur.",Data Science / Intelligence Artificielle,Tableau;Data Warehousing;R;scikit-learn,3,"Nous recherchons un profil Data Science / Intelligence Artificielle justifiant d'au moins 3 ans d'expérience. Compétences requises : Tableau, Data Warehousing, R, scikit-learn. Le candidat idéal maîtrise ces technologies et outils dans un contexte Data Science / Intelligence Artificielle.",20.14
Cybersécurité,Sécurité réseau;VPN;ISO 27001;IAM;SIEM;Sécurité réseau,6,Bac+2 (BTS/DUT),"Candidat motivé, 6 ans d'expérience en Cybersécurité, Bac+2 (BTS/DUT). Expérience professionnelle de 6 ans incluant l'utilisation de Sécurité réseau, VPN, ISO 27001, IAM, SIEM, Sécurité réseau dans des projets Cybersécurité. Qualités personnelles : esprit critique, adaptabilité, créativité.",Cybersécurité,SOC;Audit de sécurité;IAM;Firewall;ISO 27001;Ethical Hacking,0,"Offre d'emploi : spécialiste Cybersécurité, expérience minimale de 0 ans. Compétences requises : SOC, Audit de sécurité, IAM, Firewall, ISO 27001, Ethical Hacking. Le candidat idéal maîtrise ces technologies et outils dans un contexte Cybersécurité.",67.86
Design UI/UX,Sketch;UX Writing;Illustrator;After Effects;Photoshop;Wireframing;Adobe XD;Figma;Motion Design;Design Thinking,5,Bac+2 (BTS/DUT),"Candidat motivé, 5 ans d'expérience en Design UI/UX, Bac+2 (BTS/DUT). Expérience professionnelle de 5 ans incluant l'utilisation de Sketch, UX Writing, Illustrator, After Effects, Photoshop, Wireframing, Adobe XD, Figma, Motion Design, Design Thinking dans des projets Design UI/UX. Qualités personnelles : esprit critique, curiosité, autonomie.",Design UI/UX,Design Thinking;Tests utilisateurs;InVision;Accessibilité;Motion Design;Sketch;Prototypage,7,"Nous recherchons un profil Design UI/UX justifiant d'au moins 7 ans d'expérience. Compétences requises : Design Thinking, Tests utilisateurs, InVision, Accessibilité, Motion Design, Sketch, Prototypage. Le candidat idéal maîtrise ces technologies et outils dans un contexte Design UI/UX.",52.66
Marketing Digital,CRM;Marketing Automation;Stratégie digitale;Email Marketing;SEA;Branding;Content Marketing;Google Ads;HubSpot;Community Management;Google Analytics;Confluence,0,Bac+3 (Licence),"Candidat motivé, 0 ans d'expérience en Marketing Digital, Bac+3 (Licence). Compétences techniques maîtrisées : CRM, Marketing Automation, Stratégie digitale, Email Marketing, SEA, Branding, Content Marketing, Google Ads, HubSpot, Community Management, Google Analytics, Confluence. Domaine principal : Marketing Digital. Qualités personnelles : rigueur, esprit critique, autonomie.",Gestion de Projet,Product Owner;MS Project;Agile;Jira;Planification;Gestion des risques;Roadmap produit;Reporting projet;PMP,2,"Nous recherchons un profil Gestion de Projet justifiant d'au moins 2 ans d'expérience. Compétences requises : Product Owner, MS Project, Agile, Jira, Planification, Gestion des risques, Roadmap produit, Reporting projet, PMP. Le candidat idéal maîtrise ces technologies et outils dans un contexte Gestion de Projet.",1.74
DevOps / Cloud,Infrastructure as Code;Azure;Helm;GCP;Networking;Load Balancing;Docker;GitLab CI,7,Bac+5 (Master / Ingénieur),"Farah, Bac+5 (Master / Ingénieur), 7 ans d'expérience dans le domaine DevOps / Cloud. Expérience professionnelle de 7 ans incluant l'utilisation de Infrastructure as Code, Azure, Helm, GCP, Networking, Load Balancing, Docker, GitLab CI dans des projets DevOps / Cloud. Qualités personnelles : esprit critique, créativité, adaptabilité.",DevOps / Cloud,GCP;Load Balancing;AWS;Docker;Grafana;Terraform;Networking;Prometheus,3,"Nous recherchons un profil DevOps / Cloud justifiant d'au moins 3 ans d'expérience. Compétences requises : GCP, Load Balancing, AWS, Docker, Grafana, Terraform, Networking, Prometheus. Le candidat idéal maîtrise ces technologies et outils dans un contexte DevOps / Cloud.",68.83
Data Science / Intelligence Artificielle,Keras;NLP;SQL;scikit-learn;Pandas;A/B Testing;Deep Learning;Data Warehousing;TensorFlow;Hadoop;Python;AWS,3,Bac+5 (Master / Ingénieur),"Profil Data Science / Intelligence Artificielle avec 3 ans d'expérience. Diplôme : Bac+5 (Master / Ingénieur). Compétences techniques maîtrisées : Keras, NLP, SQL, scikit-learn, Pandas, A/B Testing, Deep Learning, Data Warehousing, TensorFlow, Hadoop, Python, AWS. Domaine principal : Data Science / Intelligence Artificielle. Qualités personnelles : sens de l'organisation, curiosité, leadership.",Réseaux / Systèmes,Supervision réseau;Sécurité réseau;PowerShell;Virtualisation;Cisco;DNS,2,"Nous recherchons un profil Réseaux / Systèmes justifiant d'au moins 2 ans d'expérience. Compétences requises : Supervision réseau, Sécurité réseau, PowerShell, Virtualisation, Cisco, DNS. Le candidat idéal maîtrise ces technologies et outils dans un contexte Réseaux / Systèmes.",57.92
DevOps / Cloud,AWS;Ansible;Nginx;Kubernetes;Jenkins;Prometheus;Networking;Active Directory,7,Bac+2 (BTS/DUT),"Candidat motivé, 7 ans d'expérience en DevOps / Cloud, Bac+2 (BTS/DUT). Expérience professionnelle de 7 ans incluant l'utilisation de AWS, Ansible, Nginx, Kubernetes, Jenkins, Prometheus, Networking, Active Directory dans des projets DevOps / Cloud. Qualités personnelles : esprit d'équipe, communication, autonomie.",Réseaux / Systèmes,DHCP;Windows Server;PowerShell;Supervision réseau;TCP/IP;Cisco;VMware,5,"Poste ouvert dans le domaine Réseaux / Systèmes, 5 ans d'expérience minimum requis. Compétences requises : DHCP, Windows Server, PowerShell, Supervision réseau, TCP/IP, Cisco, VMware. Le candidat idéal maîtrise ces technologies et outils dans un contexte Réseaux / Systèmes.",58.9
Développement Logiciel,CSS;SASS;Kubernetes;Maven;MySQL;PostgreSQL;Design Patterns;CI/CD;Node.js;Spring Boot,10,Bac+2 (BTS/DUT),"Candidat motivé, 10 ans d'expérience en Développement Logiciel, Bac+2 (BTS/DUT). Compétences techniques maîtrisées : CSS, SASS, Kubernetes, Maven, MySQL, PostgreSQL, Design Patterns, CI/CD, Node.js, Spring Boot. Domaine principal : Développement Logiciel. Qualités personnelles : créativité, curiosité, sens de l'organisation.",Développement Logiciel,Spring Boot;SASS;MongoDB;JavaScript,2,"Offre d'emploi : spécialiste Développement Logiciel, expérience minimale de 2 ans. Compétences requises : Spring Boot, SASS, MongoDB, JavaScript. Le candidat idéal maîtrise ces technologies et outils dans un contexte Développement Logiciel.",79.47
Finance / Comptabilité,IFRS;Consolidation;Budgétisation;Comptabilité générale;Contrôle de gestion;SAP;Excel avancé;Gestion des risques financiers;Reporting financier,0,Bac+2 (BTS/DUT),"Profil Finance / Comptabilité avec 0 ans d'expérience. Diplôme : Bac+2 (BTS/DUT). Compétences techniques maîtrisées : IFRS, Consolidation, Budgétisation, Comptabilité générale, Contrôle de gestion, SAP, Excel avancé, Gestion des risques financiers, Reporting financier. Domaine principal : Finance / Comptabilité. Qualités personnelles : esprit critique, gestion du stress, créativité.",Réseaux / Systèmes,PowerShell;VMware;Routage;Switching;DNS,3,"Offre d'emploi : spécialiste Réseaux / Systèmes, expérience minimale de 3 ans. Compétences requises : PowerShell, VMware, Routage, Switching, DNS. Le candidat idéal maîtrise ces technologies et outils dans un contexte Réseaux / Systèmes.",1.4
Marketing Digital,Facebook Ads;Google Ads;Stratégie digitale;Google Analytics;Community Management,3,Bac+3 (Licence),"Bilel, Bac+3 (Licence), 3 ans d'expérience dans le domaine Marketing Digital. Expérience professionnelle de 3 ans incluant l'utilisation de Facebook Ads, Google Ads, Stratégie digitale, Google Analytics, Community Management dans des projets Marketing Digital. Qualités personnelles : sens de l'organisation, adaptabilité, rigueur.",Marketing Digital,SEO;Content Marketing;Réseaux sociaux;Stratégie digitale,7,"Nous recherchons un profil Marketing Digital justifiant d'au moins 7 ans d'expérience. Compétences requises : SEO, Content Marketing, Réseaux sociaux, Stratégie digitale. Le candidat idéal maîtrise ces technologies et outils dans un contexte Marketing Digital.",31.87
DevOps / Cloud,Cloud Security;Jenkins;Docker;Helm;Nginx,6,Bac+2 (BTS/DUT),"Marwa - Bac+2 (BTS/DUT) - 6 années d'expérience professionnelle en DevOps / Cloud. Expérience professionnelle de 6 ans incluant l'utilisation de Cloud Security, Jenkins, Docker, Helm, Nginx dans des projets DevOps / Cloud. Qualités personnelles : esprit d'équipe, résolution de problèmes, adaptabilité.",Gestion de Projet,Product Owner;Agile;Roadmap produit;Scrum;Planification;Budget projet;Reporting projet;PRINCE2,5,"Offre d'emploi : spécialiste Gestion de Projet, expérience minimale de 5 ans. Compétences requises : Product Owner, Agile, Roadmap produit, Scrum, Planification, Budget projet, Reporting projet, PRINCE2. Le candidat idéal maîtrise ces technologies et outils dans un contexte Gestion de Projet.",47.09
Data Science / Intelligence Artificielle,Pandas;Big Data;scikit-learn;Airflow;Computer Vision,3,Bac+2 (BTS/DUT),"Candidat motivé, 3 ans d'expérience en Data Science / Intelligence Artificielle, Bac+2 (BTS/DUT). Compétences techniques maîtrisées : Pandas, Big Data, scikit-learn, Airflow, Computer Vision. Domaine principal : Data Science / Intelligence Artificielle. Qualités personnelles : communication, autonomie, gestion du stress.",Data Science / Intelligence Artificielle,TensorFlow;Pandas;Data Visualization;Hadoop;Data Warehousing,0,"Nous recherchons un profil Data Science / Intelligence Artificielle justifiant d'au moins 0 ans d'expérience. Compétences requises : TensorFlow, Pandas, Data Visualization, Hadoop, Data Warehousing. Le candidat idéal maîtrise ces technologies et outils dans un contexte Data Science / Intelligence Artificielle.",63.98
Ressources Humaines,SuccessFactors;GPEC;Formation professionnelle;SIRH;Paie;Workday;Onboarding;Gestion des talents;Relations sociales,4,Bac+5 (Master / Ingénieur),"Candidat motivé, 4 ans d'expérience en Ressources Humaines, Bac+5 (Master / Ingénieur). Expérience professionnelle de 4 ans incluant l'utilisation de SuccessFactors, GPEC, Formation professionnelle, SIRH, Paie, Workday, Onboarding, Gestion des talents, Relations sociales dans des projets Ressources Humaines. Qualités personnelles : sens de l'organisation, résolution de problèmes, gestion du stress.",Réseaux / Systèmes,Switching;Windows Server;Routage;VPN;Linux,0,"Poste ouvert dans le domaine Réseaux / Systèmes, 0 ans d'expérience minimum requis. Compétences requises : Switching, Windows Server, Routage, VPN, Linux. Le candidat idéal maîtrise ces technologies et outils dans un contexte Réseaux / Systèmes.",51.78
Marketing Digital,Réseaux sociaux;Stratégie digitale;Marketing Automation;SEO,2,Bac+3 (Licence),"Emna - Bac+3 (Licence) - 2 années d'expérience professionnelle en Marketing Digital. Expérience professionnelle de 2 ans incluant l'utilisation de Réseaux sociaux, Stratégie digitale, Marketing Automation, SEO dans des projets Marketing Digital. Qualités personnelles : leadership, esprit critique, résolution de problèmes.",Finance / Comptabilité,Comptabilité générale;Modélisation financière;SAP;Audit financier;Trésorerie;Contrôle de gestion,7,"Poste ouvert dans le domaine Finance / Comptabilité, 7 ans d'expérience minimum requis. Compétences requises : Comptabilité générale, Modélisation financière, SAP, Audit financier, Trésorerie, Contrôle de gestion. Le candidat idéal maîtrise ces technologies et outils dans un contexte Finance / Comptabilité.",17.34
Ressources Humaines,SuccessFactors;Formation professionnelle;Relations sociales;GPEC;SIRH;Droit du travail;Recrutement;Marque employeur;Onboarding;Paie;Gestion des talents,8,Bac+3 (Licence),"Profil Ressources Humaines avec 8 ans d'expérience. Diplôme : Bac+3 (Licence). Compétences techniques maîtrisées : SuccessFactors, Formation professionnelle, Relations sociales, GPEC, SIRH, Droit du travail, Recrutement, Marque employeur, Onboarding, Paie, Gestion des talents. Domaine principal : Ressources Humaines. Qualités personnelles : résolution de problèmes, adaptabilité, rigueur.",Ressources Humaines,Droit du travail;Entretien annuel;Formation professionnelle;Paie;Recrutement;SuccessFactors;GPEC;Workday,5,"Poste ouvert dans le domaine Ressources Humaines, 5 ans d'expérience minimum requis. Compétences requises : Droit du travail, Entretien annuel, Formation professionnelle, Paie, Recrutement, SuccessFactors, GPEC, Workday. Le candidat idéal maîtrise ces technologies et outils dans un contexte Ressources Humaines.",80.95
Cybersécurité,VPN;Forensics;Wireshark;Incident Response;Data Visualization,6,Doctorat (PhD),"Ahmed - Doctorat (PhD) - 6 années d'expérience professionnelle en Cybersécurité. Compétences techniques maîtrisées : VPN, Forensics, Wireshark, Incident Response, Data Visualization. Domaine principal : Cybersécurité. Qualités personnelles : curiosité, esprit d'équipe, sens de l'organisation.",Cybersécurité,Incident Response;SOC monitoring;OWASP;VPN;Firewall,2,"Offre d'emploi : spécialiste Cybersécurité, expérience minimale de 2 ans. Compétences requises : Incident Response, SOC monitoring, OWASP, VPN, Firewall. Le candidat idéal maîtrise ces technologies et outils dans un contexte Cybersécurité.",70.43
Gestion de Projet,Agile;Confluence;MS Project;Budget projet;PMP;Reporting projet;Planification;Modélisation financière,4,Bac+3 (Licence),"Candidat motivé, 4 ans d'expérience en Gestion de Projet, Bac+3 (Licence). A travaillé pendant 4 ans sur des projets liés à Gestion de Projet, en mettant en œuvre Agile, Confluence, MS Project, Budget projet, PMP, Reporting projet, Planification, Modélisation financière. Qualités personnelles : communication, esprit d'équipe, leadership.",Ressources Humaines,Onboarding;Gestion des talents;Formation professionnelle;Entretien annuel;GPEC,5,"Offre d'emploi : spécialiste Ressources Humaines, expérience minimale de 5 ans. Compétences requises : Onboarding, Gestion des talents, Formation professionnelle, Entretien annuel, GPEC. Le candidat idéal maîtrise ces technologies et outils dans un contexte Ressources Humaines.",35.92
