candidate_domain,candidate_skills,candidate_years_experience,candidate_education,cv_text,job_domain,job_skills,job_years_required,job_description,relevance_score
Finance / Comptabilité,Gestion des risques financiers;IFRS;Trésorerie;Power BI;Contrôle de gestion;Modélisation financière;Comptabilité générale;Consolidation;Fiscalité,5,Bac+3 (Licence),"Bilel - Bac+3 (Licence) - 5 années d'expérience professionnelle en Finance / Comptabilité. A travaillé pendant 5 ans sur des projets liés à Finance / Comptabilité, en mettant en œuvre Gestion des risques financiers, IFRS, Trésorerie, Power BI, Contrôle de gestion, Modélisation financière, Comptabilité générale, Consolidation, Fiscalité. Qualités personnelles : gestion du stress, communication, autonomie.",Finance / Comptabilité,Reporting financier;Budgétisation;Contrôle de gestion;Analyse financière;Gestion des risques financiers;Excel avancé,7,"Poste ouvert dans le domaine Finance / Comptabilité, 7 ans d'expérience minimum requis. Compétences requises : Reporting financier, Budgétisation, Contrôle de gestion, Analyse financière, Gestion des risques financiers, Excel avancé. Le candidat idéal maîtrise ces technologies et outils dans un contexte Finance / Comptabilité.",47.76
Design UI/UX,Figma;Design Thinking;Sketch;Prototypage;Illustrator;Photoshop;User Research;UX Writing;Accessibilité;After Effects;UI Design,0,Bac+2 (BTS/DUT),"Profil Design UI/UX avec 0 ans d'expérience. Diplôme : Bac+2 (BTS/DUT). A travaillé pendant 0 ans sur des projets liés à Design UI/UX, en mettant en œuvre Figma, Design Thinking, Sketch, Prototypage, Illustrator, Photoshop, User Research, UX Writing, Accessibilité, After Effects, UI Design. Qualités personnelles : esprit critique, rigueur, adaptabilité.",Design UI/UX,Accessibilité;Adobe XD;Illustrator;UI Design;UX Writing;After Effects;Design System,7,"Nous recherchons un profil Design UI/UX justifiant d'au moins 7 ans d'expérience. Compétences requises : Accessibilité, Adobe XD, Illustrator, UI Design, UX Writing, After Effects, Design System. Le candidat idéal maîtrise ces technologies et outils dans un contexte Design UI/UX.",44.87
Marketing Digital,SEO;Réseaux sociaux;Email Marketing;Google Analytics,11,Bac+2 (BTS/DUT),"Candidat motivé, 11 ans d'expérience en Marketing Digital, Bac+2 (BTS/DUT). Expérience professionnelle de 11 ans incluant l'utilisation de SEO, Réseaux sociaux, Email Marketing, Google Analytics dans des projets Marketing Digital. Qualités personnelles : esprit d'équipe, esprit critique, adaptabilité.",Marketing Digital,Growth Hacking;Branding;CRM;Stratégie digitale;Email Marketing;Facebook Ads,7,"Poste ouvert dans le domaine Marketing Digital, 7 ans d'expérience minimum requis. Compétences requises : Growth Hacking, Branding, CRM, Stratégie digitale, Email Marketing, Facebook Ads. Le candidat idéal maîtrise ces technologies et outils dans un contexte Marketing Digital.",69.71
DevOps / Cloud,GCP;Grafana;Vagrant;Linux;Load Balancing;Docker;AWS;Monitoring;NumPy,2,Bac+5 (Master / Ingénieur),"Firas, Bac+5 (Master / Ingénieur), 2 ans d'expérience dans le domaine DevOps / Cloud. A travaillé pendant 2 ans sur des projets liés à DevOps / Cloud, en mettant en œuvre GCP, Grafana, Vagrant, Linux, Load Balancing, Docker, AWS, Monitoring, NumPy. Qualités personnelles : gestion du stress, communication, autonomie.",DevOps / Cloud,GCP;AWS;Linux;Cloud Security;Kubernetes,5,"Offre d'emploi : spécialiste DevOps / Cloud, expérience minimale de 5 ans. Compétences requises : GCP, AWS, Linux, Cloud Security, Kubernetes. Le candidat idéal maîtrise ces technologies et outils dans un contexte DevOps / Cloud.",45.8
Ressources Humaines,Recrutement;SuccessFactors;Paie;SIRH;Gestion des talents,5,Bac+5 (Master / Ingénieur),"Sami, Bac+5 (Master / Ingénieur), 5 ans d'expérience dans le domaine Ressources Humaines. A travaillé pendant 5 ans sur des projets liés à Ressources Humaines, en mettant en œuvre Recrutement, SuccessFactors, Paie, SIRH, Gestion des talents. Qualités personnelles : leadership, esprit critique, rigueur.",Ressources Humaines,Gestion des talents;GPEC;Formation professionnelle;Entretien annuel;SIRH;Onboarding;SuccessFactors;Workday;Marque employeur,5,"Offre d'emploi : spécialiste Ressources Humaines, expérience minimale de 5 ans. Compétences requises : Gestion des talents, GPEC, Formation professionnelle, Entretien annuel, SIRH, Onboarding, SuccessFactors, Workday, Marque employeur. Le candidat idéal maîtrise ces technologies et outils dans un contexte Ressources Humaines.",64.41
DevOps / Cloud,Grafana;Terraform;Load Balancing;AWS;User Research,5,Bac+5 (Master / Ingénieur),"Profil DevOps / Cloud avec 5 ans d'expérience. Diplôme : Bac+5 (Master / Ingénieur). Compétences techniques maîtrisées : Grafana, Terraform, Load Balancing, AWS, User Research. Domaine principal : DevOps / Cloud. Qualités personnelles : créativité, rigueur, communication.",DevOps / Cloud,Ansible;Terraform;Linux;Jenkins,1,"Poste ouvert dans le domaine DevOps / Cloud, 1 ans d'expérience minimum requis. Compétences requises : Ansible, Terraform, Linux, Jenkins. Le candidat idéal maîtrise ces technologies et outils dans un contexte DevOps / Cloud.",58.11
Gestion de Projet,Jira;Confluence;Roadmap produit;PMP;MS Project;Scrum;PRINCE2;Kanban;Agile;Budget projet;Formation professionnelle,3,Doctorat (PhD),"Ahmed, Doctorat (PhD), 3 ans d'expérience dans le domaine Gestion de Projet. Compétences techniques maîtrisées : Jira, Confluence, Roadmap produit, PMP, MS Project, Scrum, PRINCE2, Kanban, Agile, Budget projet, Formation professionnelle. Domaine principal : Gestion de Projet. Qualités personnelles : leadership, communication, sens de l'organisation.",Gestion de Projet,Product Owner;Agile;Confluence;Budget projet;Roadmap produit;Reporting projet;Jira;PRINCE2;Kanban,3,"Poste ouvert dans le domaine Gestion de Projet, 3 ans d'expérience minimum requis. Compétences requises : Product Owner, Agile, Confluence, Budget projet, Roadmap produit, Reporting projet, Jira, PRINCE2, Kanban. Le candidat idéal maîtrise ces technologies et outils dans un contexte Gestion de Projet.",86.41
Ressources Humaines,SuccessFactors;SIRH;Workday;Marque employeur;Paie;Recrutement;Formation professionnelle;Entretien annuel;Relations sociales;Droit du travail;Gestion des talents;GPEC,4,Doctorat (PhD),"Candidat motivé, 4 ans d'expérience en Ressources Humaines, Doctorat (PhD). Expérience professionnelle de 4 ans incluant l'utilisation de SuccessFactors, SIRH, Workday, Marque employeur, Paie, Recrutement, Formation professionnelle, Entretien annuel, Relations sociales, Droit du travail, Gestion des talents, GPEC dans des projets Ressources Humaines. Qualités personnelles : sens de l'organisation, curiosité, autonomie.",Ressources Humaines,GPEC;Workday;Recrutement;Paie;Formation professionnelle;SuccessFactors;Onboarding;Entretien annuel;Gestion des talents;SIRH,2,"Nous recherchons un profil Ressources Humaines justifiant d'au moins 2 ans d'expérience. Compétences requises : GPEC, Workday, Recrutement, Paie, Formation professionnelle, SuccessFactors, Onboarding, Entretien annuel, Gestion des talents, SIRH. Le candidat idéal maîtrise ces technologies et outils dans un contexte Ressources Humaines.",96.01
Finance / Comptabilité,Analyse financière;Comptabilité générale;Budgétisation;IFRS;Contrôle de gestion;SAP;Fiscalité,9,Bac+3 (Licence),"Candidat motivé, 9 ans d'expérience en Finance / Comptabilité, Bac+3 (Licence). Expérience professionnelle de 9 ans incluant l'utilisation de Analyse financière, Comptabilité générale, Budgétisation, IFRS, Contrôle de gestion, SAP, Fiscalité dans des projets Finance / Comptabilité. Qualités personnelles : autonomie, adaptabilité, résolution de problèmes.",Finance / Comptabilité,IFRS;Trésorerie;Consolidation;Gestion des risques financiers;Budgétisation,3,"Nous recherchons un profil Finance / Comptabilité justifiant d'au moins 3 ans d'expérience. Compétences requises : IFRS, Trésorerie, Consolidation, Gestion des risques financiers, Budgétisation. Le candidat idéal maîtrise ces technologies et outils dans un contexte Finance / Comptabilité.",78.64
Ressources Humaines,SuccessFactors;Onboarding;Marque employeur;Droit du travail;Paie;SIRH;Relations sociales;Workday;Gestion des talents,4,Bac+2 (BTS/DUT),"Farah, Bac+2 (BTS/DUT), 4 ans d'expérience dans le domaine Ressources Humaines. Expérience professionnelle de 4 ans incluant l'utilisation de SuccessFactors, Onboarding, Marque employeur, Droit du travail, Paie, SIRH, Relations sociales, Workday, Gestion des talents dans des projets Ressources Humaines. Qualités personnelles : esprit critique, autonomie, gestion du stress.",Ressources Humaines,Marque employeur;GPEC;Workday;Gestion des talents;Paie;Droit du travail;Entretien annuel;Formation professionnelle;SuccessFactors,7,"Nous recherchons un profil Ressources Humaines justifiant d'au moins 7 ans d'expérience. Compétences requises : Marque employeur, GPEC, Workday, Gestion des talents, Paie, Droit du travail, Entretien annuel, Formation professionnelle, SuccessFactors. Le candidat idéal maîtrise ces technologies et outils dans un contexte Ressources Humaines.",61.25
Marketing Digital,Copywriting;Google Analytics;Content Marketing;Growth Hacking;Stratégie digitale;Community Management;Facebook Ads;Réseaux sociaux;HubSpot;CRM,8,Doctorat (PhD),"Profil Marketing Digital avec 8 ans d'expérience. Diplôme : Doctorat (PhD). A travaillé pendant 8 ans sur des projets liés à Marketing Digital, en mettant en œuvre Copywriting, Google Analytics, Content Marketing, Growth Hacking, Stratégie digitale, Community Management, Facebook Ads, Réseaux sociaux, HubSpot, CRM. Qualités personnelles : gestion du stress, esprit critique, créativité.",Cybersécurité,Incident Response;OWASP;SOC monitoring;Kali Linux;Gestion des risques;Wireshark;Pentest;Cryptographie;Forensics,0,"Poste ouvert dans le domaine Cybersécurité, 0 ans d'expérience minimum requis. Compétences requises : Incident Response, OWASP, SOC monitoring, Kali Linux, Gestion des risques, Wireshark, Pentest, Cryptographie, Forensics. Le candidat idéal maîtrise ces technologies et outils dans un contexte Cybersécurité.",52.34
DevOps / Cloud,GCP;Grafana;Monitoring;Ansible;GitLab CI;Kubernetes;Bash;Prometheus,8,Bac+5 (Master / Ingénieur),"Candidat motivé, 8 ans d'expérience en DevOps / Cloud, Bac+5 (Master / Ingénieur). A travaillé pendant 8 ans sur des projets liés à DevOps / Cloud, en mettant en œuvre GCP, Grafana, Monitoring, Ansible, GitLab CI, Kubernetes, Bash, Prometheus. Qualités personnelles : rigueur, esprit critique, esprit d'équipe.",DevOps / Cloud,Cloud Security;Nginx;Helm;Kubernetes;GitLab CI;Linux;Networking;Terraform;CI/CD;Vagrant,1,"Offre d'emploi : spécialiste DevOps / Cloud, expérience minimale de 1 ans. Compétences requises : Cloud Security, Nginx, Helm, Kubernetes, GitLab CI, Linux, Networking, Terraform, CI/CD, Vagrant. Le candidat idéal maîtrise ces technologies et outils dans un contexte DevOps / Cloud.",64.22
Cybersécurité,Wireshark;Incident Response;Gestion des risques;OWASP;Sécurité réseau;Analyse de vulnérabilités;Ethical Hacking,5,Bac+2 (BTS/DUT),"Hamza, Bac+2 (BTS/DUT), 5 ans d'expérience dans le domaine Cybersécurité. Expérience professionnelle de 5 ans incluant l'utilisation de Wireshark, Incident Response, Gestion des risques, OWASP, Sécurité réseau, Analyse de vulnérabilités, Ethical Hacking dans des projets Cybersécurité. Qualités personnelles : adaptabilité, rigueur, autonomie.",Cybersécurité,Ethical Hacking;SIEM;VPN;Audit de sécurité,1,"Poste ouvert dans le domaine Cybersécurité, 1 ans d'expérience minimum requis. Compétences requises : Ethical Hacking, SIEM, VPN, Audit de sécurité. Le candidat idéal maîtrise ces technologies et outils dans un contexte Cybersécurité.",66.46
Finance / Comptabilité,Gestion des risques financiers;SAP;IFRS;Modélisation financière;Excel avancé,1,Bac+3 (Licence),"Candidat motivé, 1 ans d'expérience en Finance / Comptabilité, Bac+3 (Licence). Expérience professionnelle de 1 ans incluant l'utilisation de Gestion des risques financiers, SAP, IFRS, Modélisation financière, Excel avancé dans des projets Finance / Comptabilité. Qualités personnelles : autonomie, créativité, curiosité.",Finance / Comptabilité,Analyse financière;Comptabilité générale;Fiscalité;Audit financier,3,"Poste ouvert dans le domaine Finance / Comptabilité, 3 ans d'expérience minimum requis. Compétences requises : Analyse financière, Comptabilité générale, Fiscalité, Audit financier. Le candidat idéal maîtrise ces technologies et outils dans un contexte Finance / Comptabilité.",16.65
DevOps / Cloud,Monitoring;Terraform;Linux;Azure;CI/CD;Cloud Security;Infrastructure as Code;Grafana;GitLab CI;Kali Linux,1,Doctorat (PhD),"Ines, Doctorat (PhD), 1 ans d'expérience dans le domaine DevOps / Cloud. A travaillé pendant 1 ans sur des projets liés à DevOps / Cloud, en mettant en œuvre Monitoring, Terraform, Linux, Azure, CI/CD, Cloud Security, Infrastructure as Code, Grafana, GitLab CI, Kali Linux. Qualités personnelles : autonomie, curiosité, communication.",DevOps / Cloud,Jenkins;GCP;Bash;Cloud Security;Linux;Networking;Prometheus;Terraform;Monitoring,0,"Poste ouvert dans le domaine DevOps / Cloud, 0 ans d'expérience minimum requis. Compétences requises : Jenkins, GCP, Bash, Cloud Security, Linux, Networking, Prometheus, Terraform, Monitoring. Le candidat idéal maîtrise ces technologies et outils dans un contexte DevOps / Cloud.",69.63
Finance / Comptabilité,Consolidation;Contrôle de gestion;Audit financier;Analyse financière;Excel avancé;IFRS;Modélisation financière;Gestion des risques financiers;Budgétisation;Power BI,1,Bac+2 (BTS/DUT),"Anis, Bac+2 (BTS/DUT), 1 ans d'expérience dans le domaine Finance / Comptabilité. Compétences techniques maîtrisées : Consolidation, Contrôle de gestion, Audit financier, Analyse financière, Excel avancé, IFRS, Modélisation financière, Gestion des risques financiers, Budgétisation, Power BI. Domaine principal : Finance / Comptabilité. Qualités personnelles : esprit critique, résolution de problèmes, esprit d'équipe.",Finance / Comptabilité,Consolidation;Excel avancé;IFRS;Comptabilité générale;Gestion des risques financiers;Modélisation financière;Trésorerie;Contrôle de gestion;Budgétisation;Analyse financière,5,"Poste ouvert dans le domaine Finance / Comptabilité, 5 ans d'expérience minimum requis. Compétences requises : Consolidation, Excel avancé, IFRS, Comptabilité générale, Gestion des risques financiers, Modélisation financière, Trésorerie, Contrôle de gestion, Budgétisation, Analyse financière. Le candidat idéal maîtrise ces technologies et outils dans un contexte Finance / Comptabilité.",47.49
Marketing Digital,SEO;HubSpot;Growth Hacking;Community Management;Email Marketing;CRM;SEA;Facebook Ads;Google Analytics;Réseaux sociaux;Stratégie digitale,10,Doctorat (PhD),"Candidat motivé, 10 ans d'expérience en Marketing Digital, Doctorat (PhD). A travaillé pendant 10 ans sur des projets liés à Marketing Digital, en mettant en œuvre SEO, HubSpot, Growth Hacking, Community Management, Email Marketing, CRM, SEA, Facebook Ads, Google Analytics, Réseaux sociaux, Stratégie digitale. Qualités personnelles : gestion du stress, communication, créativité.",Gestion de Projet,Kanban;Gestion des risques;PMP;PRINCE2;MS Project;Scrum;Jira;Product Owner;Planification;Reporting projet,5,"Poste ouvert dans le domaine Gestion de Projet, 5 ans d'expérience minimum requis. Compétences requises : Kanban, Gestion des risques, PMP, PRINCE2, MS Project, Scrum, Jira, Product Owner, Planification, Reporting projet. Le candidat idéal maîtrise ces technologies et outils dans un contexte Gestion de Projet.",52.14
DevOps / Cloud,Monitoring;Docker;CI/CD;Grafana;AWS;Infrastructure as Code;Vagrant;Networking,4,Bac+5 (Master / Ingénieur),"Rania, Bac+5 (Master / Ingénieur), 4 ans d'expérience dans le domaine DevOps / Cloud. Expérience professionnelle de 4 ans incluant l'utilisation de Monitoring, Docker, CI/CD, Grafana, AWS, Infrastructure as Code, Vagrant, Networking dans des projets DevOps / Cloud. Qualités personnelles : communication, rigueur, esprit critique.",Marketing Digital,Email Marketing;Stratégie digitale;Marketing Automation;Réseaux sociaux;Content Marketing;Copywriting;SEO;Google Analytics;Branding;SEA,5,"Nous recherchons un profil Marketing Digital justifiant d'au moins 5 ans d'expérience. Compétences requises : Email Marketing, Stratégie digitale, Marketing Automation, Réseaux sociaux, Content Marketing, Copywriting, SEO, Google Analytics, Branding, SEA. Le candidat idéal maîtrise ces technologies et outils dans un contexte Marketing Digital.",43.85
Design UI/UX,Motion Design;UX Writing;UI Design;Prototypage;Design System;Wireframing;Tests utilisateurs,8,Bac+3 (Licence),"Candidat motivé, 8 ans d'expérience en Design UI/UX, Bac+3 (Licence). Expérience professionnelle de 8 ans incluant l'utilisation de Motion Design, UX Writing, UI Design, Prototypage, Design System, Wireframing, Tests utilisateurs dans des projets Design UI/UX. Qualités personnelles : résolution de problèmes, créativité, adaptabilité.",Cybersécurité,ISO 27001;Pentest;SOC monitoring;SOC,0,"Poste ouvert dans le domaine Cybersécurité, 0 ans d'expérience minimum requis. Compétences requises : ISO 27001, Pentest, SOC monitoring, SOC. Le candidat idéal maîtrise ces technologies et outils dans un contexte Cybersécurité.",43.21
Développement Logiciel,Angular;Spring Boot;REST API;RabbitMQ;MongoDB;Design Patterns,2,Doctorat (PhD),"Ahmed - Doctorat (PhD) - 2 années d'expérience professionnelle en Développement Logiciel. A travaillé pendant 2 ans sur des projets liés à Développement Logiciel, en mettant en œuvre Angular, Spring Boot, REST API, RabbitMQ, MongoDB, Design Patterns. Qualités personnelles : adaptabilité, leadership, esprit d'équipe.",Développement Logiciel,React;PostgreSQL;Node.js;Git,3,"Nous recherchons un profil Développement Logiciel justifiant d'au moins 3 ans d'expérience. Compétences requises : React, PostgreSQL, Node.js, Git. Le candidat idéal maîtrise ces technologies et outils dans un contexte Développement Logiciel.",39.56
Data Science / Intelligence Artificielle,Python;TensorFlow;Deep Learning;NumPy;Data Visualization;R,10,Bac+2 (BTS/DUT),"Sami - Bac+2 (BTS/DUT) - 10 années d'expérience professionnelle en Data Science / Intelligence Artificielle. Expérience professionnelle de 10 ans incluant l'utilisation de Python, TensorFlow, Deep Learning, NumPy, Data Visualization, R dans des projets Data Science / Intelligence Artificielle. Qualités personnelles : esprit d'équipe, créativité, sens de l'organisation.",Data Science / Intelligence Artificielle,PyTorch;Pandas;Deep Learning;Spark;Feature Engineering;A/B Testing;Python;Machine Learning;Power BI,3,"Poste ouvert dans le domaine Data Science / Intelligence Artificielle, 3 ans d'expérience minimum requis. Compétences requises : PyTorch, Pandas, Deep Learning, Spark, Feature Engineering, A/B Testing, Python, Machine Learning, Power BI. Le candidat idéal maîtrise ces technologies et outils dans un contexte Data Science / Intelligence Artificielle.",56.28
Finance / Comptabilité,Power BI;SAP;Consolidation;Modélisation financière;IFRS,4,Bac+2 (BTS/DUT),"Wael - Bac+2 (BTS/DUT) - 4 années d'expérience professionnelle en Finance / Comptabilité. A travaillé pendant 4 ans sur des projets liés à Finance / Comptabilité, en mettant en œuvre Power BI, SAP, Consolidation, Modélisation financière, IFRS. Qualités personnelles : esprit critique, adaptabilité, rigueur.",Finance / Comptabilité,Power BI;Comptabilité générale;Reporting financier;Modélisation financière;Trésorerie;Budgétisation;Audit financier,7,"Poste ouvert dans le domaine Finance / Comptabilité, 7 ans d'expérience minimum requis. Compétences requises : Power BI, Comptabilité générale, Reporting financier, Modélisation financière, Trésorerie, Budgétisation, Audit financier. Le candidat idéal maîtrise ces technologies et outils dans un contexte Finance / Comptabilité.",43.59
Cybersécurité,Audit de sécurité;Kali Linux;Cryptographie;VPN;IAM;Wireshark;SOC monitoring;Forensics;Sécurité réseau;Budgétisation,5,Bac+2 (BTS/DUT),"Profil Cybersécurité avec 5 ans d'expérience. Diplôme : Bac+2 (BTS/DUT). Compétences techniques maîtrisées : Audit de sécurité, Kali Linux, Cryptographie, VPN, IAM, Wireshark, SOC monitoring, Forensics, Sécurité réseau, Budgétisation. Domaine principal : Cybersécurité. Qualités personnelles : leadership, gestion du stress, sens de l'organisation.",Marketing Digital,Facebook Ads;HubSpot;CRM;Email Marketing;Content Marketing,3,"Nous recherchons un profil Marketing Digital justifiant d'au moins 3 ans d'expérience. Compétences requises : Facebook Ads, HubSpot, CRM, Email Marketing, Content Marketing. Le candidat idéal maîtrise ces technologies et outils dans un contexte Marketing Digital.",53.4
Gestion de Projet,Planification;Reporting projet;MS Project;Product Owner;Kanban;Scrum;Confluence;Jira;PRINCE2;Agile;Budget projet,4,Bac+3 (Licence),"Profil Gestion de Projet avec 4 ans d'expérience. Diplôme : Bac+3 (Licence). Compétences techniques maîtrisées : Planification, Reporting projet, MS Project, Product Owner, Kanban, Scrum, Confluence, Jira, PRINCE2, Agile, Budget projet. Domaine principal : Gestion de Projet. Qualités personnelles : autonomie, rigueur, leadership.",Gestion de Projet,Agile;MS Project;Reporting projet;Scrum;Roadmap produit;PRINCE2;Product Owner,2,"Offre d'emploi : spécialiste Gestion de Projet, expérience minimale de 2 ans. Compétences requises : Agile, MS Project, Reporting projet, Scrum, Roadmap produit, PRINCE2, Product Owner. Le candidat idéal maîtrise ces technologies et outils dans un contexte Gestion de Projet.",93.29
DevOps / Cloud,Docker;Linux;Bash;Helm;Monitoring;Load Balancing;Infrastructure as Code;Vagrant;CI/CD;Terraform;Cloud Security,3,Bac+3 (Licence),"Molka, Bac+3 (Licence), 3 ans d'expérience dans le domaine DevOps / Cloud. A travaillé pendant 3 ans sur des projets liés à DevOps / Cloud, en mettant en œuvre Docker, Linux, Bash, Helm, Monitoring, Load Balancing, Infrastructure as Code, Vagrant, CI/CD, Terraform, Cloud Security. Qualités personnelles : esprit critique, curiosité, sens de l'organisation.",DevOps / Cloud,Ansible;AWS;Load Balancing;Docker;Nginx;Kubernetes;GCP;Bash;Cloud Security,1,"Poste ouvert dans le domaine DevOps / Cloud, 1 ans d'expérience minimum requis. Compétences requises : Ansible, AWS, Load Balancing, Docker, Nginx, Kubernetes, GCP, Bash, Cloud Security. Le candidat idéal maîtrise ces technologies et outils dans un contexte DevOps / Cloud.",64.79
Design UI/UX,Figma;Tests utilisateurs;Adobe XD;Photoshop,7,Bac+2 (BTS/DUT),"Rania, Bac+2 (BTS/DUT), 7 ans d'expérience dans le domaine Design UI/UX. A travaillé pendant 7 ans sur des projets liés à Design UI/UX, en mettant en œuvre Figma, Tests utilisateurs, Adobe XD, Photoshop. Qualités personnelles : adaptabilité, sens de l'organisation, communication.",Design UI/UX,UX Writing;Figma;UI Design;Tests utilisateurs;Illustrator;Prototypage,3,"Poste ouvert dans le domaine Design UI/UX, 3 ans d'expérience minimum requis. Compétences requises : UX Writing, Figma, UI Design, Tests utilisateurs, Illustrator, Prototypage. Le candidat idéal maîtrise ces technologies et outils dans un contexte Design UI/UX.",67.63
Cybersécurité,Kali Linux;SOC;Incident Response;IAM,0,Doctorat (PhD),"Ahmed - Doctorat (PhD) - 0 années d'expérience professionnelle en Cybersécurité. Compétences techniques maîtrisées : Kali Linux, SOC, Incident Response, IAM. Domaine principal : Cybersécurité. Qualités personnelles : sens de l'organisation, leadership, résolution de problèmes.",Ressources Humaines,Marque employeur;Workday;Formation professionnelle;Onboarding;Recrutement;GPEC;Entretien annuel;SIRH;SuccessFactors,3,"Poste ouvert dans le domaine Ressources Humaines, 3 ans d'expérience minimum requis. Compétences requises : Marque employeur, Workday, Formation professionnelle, Onboarding, Recrutement, GPEC, Entretien annuel, SIRH, SuccessFactors. Le candidat idéal maîtrise ces technologies et outils dans un contexte Ressources Humaines.",0.0
Réseaux / Systèmes,DHCP;DNS;Routage;Virtualisation;TCP/IP,5,Bac+2 (BTS/DUT),"Candidat motivé, 5 ans d'expérience en Réseaux / Systèmes, Bac+2 (BTS/DUT). A travaillé pendant 5 ans sur des projets liés à Réseaux / Systèmes, en mettant en œuvre DHCP, DNS, Routage, Virtualisation, TCP/IP. Qualités personnelles : gestion du stress, adaptabilité, résolution de problèmes.",Ressources Humaines,Marque employeur;GPEC;Gestion des talents;Recrutement;Paie,5,"Offre d'emploi : spécialiste Ressources Humaines, expérience minimale de 5 ans. Compétences requises : Marque employeur, GPEC, Gestion des talents, Recrutement, Paie. Le candidat idéal maîtrise ces technologies et outils dans un contexte Ressources Humaines.",59.5
