candidate_domain,candidate_skills,candidate_years_experience,candidate_education,cv_text,job_domain,job_skills,job_years_required,job_description,relevance_score
Finance / Comptabilité,Contrôle de gestion;Modélisation financière;Trésorerie;Consolidation;SAP;Gestion des risques financiers;Comptabilité générale;Budgétisation;Excel avancé;Audit financier,2,Doctorat (PhD),"Karim - Doctorat (PhD) - 2 années d'expérience professionnelle en Finance / Comptabilité. Compétences techniques maîtrisées : Contrôle de gestion, Modélisation financière, Trésorerie, Consolidation, SAP, Gestion des risques financiers, Comptabilité générale, Budgétisation, Excel avancé, Audit financier. Domaine principal : Finance / Comptabilité. Qualités personnelles : résolution de problèmes, esprit d'équipe, curiosité.",Finance / Comptabilité,Excel avancé;Consolidation;Analyse financière;Gestion des risques financiers;Reporting financier,5,"Nous recherchons un profil Finance / Comptabilité justifiant d'au moins 5 ans d'expérience. Compétences requises : Excel avancé, Consolidation, Analyse financière, Gestion des risques financiers, Reporting financier. Le candidat idéal maîtrise ces technologies et outils dans un contexte Finance / Comptabilité.",42.16
Développement Logiciel,REST API;Node.js;Angular;JavaScript;Maven,5,Bac+3 (Licence),"Salma, Bac+3 (Licence), 5 ans d'expérience dans le domaine Développement Logiciel. Compétences techniques maîtrisées : REST API, Node.js, Angular, JavaScript, Maven. Domaine principal : Développement Logiciel. Qualités personnelles : gestion du stress, résolution de problèmes, autonomie.",Gestion de Projet,MS Project;Planification;Gestion des risques;Jira;Scrum;Agile;PRINCE2,5,"Poste ouvert dans le domaine Gestion de Projet, 5 ans d'expérience minimum requis. Compétences requises : MS Project, Planification, Gestion des risques, Jira, Scrum, Agile, PRINCE2. Le candidat idéal maîtrise ces technologies et outils dans un contexte Gestion de Projet.",50.37
Design UI/UX,Figma;Adobe XD;UX Writing;Wireframing;Sketch;Tests utilisateurs,0,Bac+2 (BTS/DUT),"Candidat motivé, 0 ans d'expérience en Design UI/UX, Bac+2 (BTS/DUT). Expérience professionnelle de 0 ans incluant l'utilisation de Figma, Adobe XD, UX Writing, Wireframing, Sketch, Tests utilisateurs dans des projets Design UI/UX. Qualités personnelles : esprit critique, résolution de problèmes, sens de l'organisation.",Design UI/UX,After Effects;Accessibilité;UX Writing;UI Design;Wireframing;Motion Design,3,"Poste ouvert dans le domaine Design UI/UX, 3 ans d'expérience minimum requis. Compétences requises : After Effects, Accessibilité, UX Writing, UI Design, Wireframing, Motion Design. Le candidat idéal maîtrise ces technologies et outils dans un contexte Design UI/UX.",26.97
Finance / Comptabilité,Consolidation;Contrôle de gestion;Excel avancé;SAP;Reporting financier;Modélisation financière;Analyse financière;Trésorerie;Fiscalité;Power BI,5,Bac+5 (Master / Ingénieur),"Profil Finance / Comptabilité avec 5 ans d'expérience. Diplôme : Bac+5 (Master / Ingénieur). A travaillé pendant 5 ans sur des projets liés à Finance / Comptabilité, en mettant en œuvre Consolidation, Contrôle de gestion, Excel avancé, SAP, Reporting financier, Modélisation financière, Analyse financière, Trésorerie, Fiscalité, Power BI. Qualités personnelles : rigueur, autonomie, esprit d'équipe.",Finance / Comptabilité,Comptabilité générale;SAP;Contrôle de gestion;Trésorerie,2,"Offre d'emploi : spécialiste Finance / Comptabilité, expérience minimale de 2 ans. Compétences requises : Comptabilité générale, SAP, Contrôle de gestion, Trésorerie. Le candidat idéal maîtrise ces technologies et outils dans un contexte Finance / Comptabilité.",81.02
Cybersécurité,SIEM;Kali Linux;Audit de sécurité;Firewall;Ethical Hacking,4,Bac+5 (Master / Ingénieur),"Mehdi - Bac+5 (Master / Ingénieur) - 4 années d'expérience professionnelle en Cybersécurité. Compétences techniques maîtrisées : SIEM, Kali Linux, Audit de sécurité, Firewall, Ethical Hacking. Domaine principal : Cybersécurité. Qualités personnelles : curiosité, résolution de problèmes, communication.",Cybersécurité,Analyse de vulnérabilités;ISO 27001;Pentest;SOC;SOC monitoring;Incident Response;Ethical Hacking;Sécurité réseau,0,"Offre d'emploi : spécialiste Cybersécurité, expérience minimale de 0 ans. Compétences requises : Analyse de vulnérabilités, ISO 27001, Pentest, SOC, SOC monitoring, Incident Response, Ethical Hacking, Sécurité réseau. Le candidat idéal maîtrise ces technologies et outils dans un contexte Cybersécurité.",48.91
DevOps / Cloud,Terraform;Helm;Linux;Ansible;Networking;Monitoring;Infrastructure as Code,8,Bac+2 (BTS/DUT),"Aziz, Bac+2 (BTS/DUT), 8 ans d'expérience dans le domaine DevOps / Cloud. Expérience professionnelle de 8 ans incluant l'utilisation de Terraform, Helm, Linux, Ansible, Networking, Monitoring, Infrastructure as Code dans des projets DevOps / Cloud. Qualités personnelles : esprit critique, esprit d'équipe, gestion du stress.",Marketing Digital,Copywriting;CRM;Growth Hacking;SEO;Content Marketing,5,"Offre d'emploi : spécialiste Marketing Digital, expérience minimale de 5 ans. Compétences requises : Copywriting, CRM, Growth Hacking, SEO, Content Marketing. Le candidat idéal maîtrise ces technologies et outils dans un contexte Marketing Digital.",52.66
DevOps / Cloud,Azure;Grafana;Monitoring;Helm,3,Bac+3 (Licence),"Profil DevOps / Cloud avec 3 ans d'expérience. Diplôme : Bac+3 (Licence). Expérience professionnelle de 3 ans incluant l'utilisation de Azure, Grafana, Monitoring, Helm dans des projets DevOps / Cloud. Qualités personnelles : leadership, rigueur, esprit critique.",DevOps / Cloud,Ansible;Load Balancing;Cloud Security;Monitoring;Vagrant;Helm;Nginx;Networking,7,"Nous recherchons un profil DevOps / Cloud justifiant d'au moins 7 ans d'expérience. Compétences requises : Ansible, Load Balancing, Cloud Security, Monitoring, Vagrant, Helm, Nginx, Networking. Le candidat idéal maîtrise ces technologies et outils dans un contexte DevOps / Cloud.",30.48
Réseaux / Systèmes,Active Directory;DNS;DHCP;Linux;TCP/IP;Sécurité réseau;VPN;VMware;Supervision réseau;Windows Server;Pandas,11,Bac+2 (BTS/DUT),"Profil Réseaux / Systèmes avec 11 ans d'expérience. Diplôme : Bac+2 (BTS/DUT). Compétences techniques maîtrisées : Active Directory, DNS, DHCP, Linux, TCP/IP, Sécurité réseau, VPN, VMware, Supervision réseau, Windows Server, Pandas. Domaine principal : Réseaux / Systèmes. Qualités personnelles : résolution de problèmes, autonomie, rigueur.",DevOps / Cloud,Vagrant;Helm;Load Balancing;Jenkins,2,"Nous recherchons un profil DevOps / Cloud justifiant d'au moins 2 ans d'expérience. Compétences requises : Vagrant, Helm, Load Balancing, Jenkins. Le candidat idéal maîtrise ces technologies et outils dans un contexte DevOps / Cloud.",43.73
Ressources Humaines,GPEC;Onboarding;SuccessFactors;Workday;SASS,2,Bac+2 (BTS/DUT),"Molka - Bac+2 (BTS/DUT) - 2 années d'expérience professionnelle en Ressources Humaines. Compétences techniques maîtrisées : GPEC, Onboarding, SuccessFactors, Workday, SASS. Domaine principal : Ressources Humaines. Qualités personnelles : autonomie, esprit d'équipe, résolution de problèmes.",Ressources Humaines,Relations sociales;Droit du travail;SIRH;Gestion des talents;Paie;Onboarding;SuccessFactors;Workday;Formation professionnelle;Recrutement,3,"Offre d'emploi : spécialiste Ressources Humaines, expérience minimale de 3 ans. Compétences requises : Relations sociales, Droit du travail, SIRH, Gestion des talents, Paie, Onboarding, SuccessFactors, Workday, Formation professionnelle, Recrutement. Le candidat idéal maîtrise ces technologies et outils dans un contexte Ressources Humaines.",48.63
Data Science / Intelligence Artificielle,Statistiques;A/B Testing;Computer Vision;Big Data;Feature Engineering;Power BI;scikit-learn,2,Doctorat (PhD),"Firas, Doctorat (PhD), 2 ans d'expérience dans le domaine Data Science / Intelligence Artificielle. Compétences techniques maîtrisées : Statistiques, A/B Testing, Computer Vision, Big Data, Feature Engineering, Power BI, scikit-learn. Domaine principal : Data Science / Intelligence Artificielle. Qualités personnelles : curiosité, autonomie, leadership.",Data Science / Intelligence Artificielle,Spark;Statistiques;ETL;scikit-learn;Keras;Big Data;R;TensorFlow;PyTorch,2,"Poste ouvert dans le domaine Data Science / Intelligence Artificielle, 2 ans d'expérience minimum requis. Compétences requises : Spark, Statistiques, ETL, scikit-learn, Keras, Big Data, R, TensorFlow, PyTorch. Le candidat idéal maîtrise ces technologies et outils dans un contexte Data Science / Intelligence Artificielle.",66.75
Cybersécurité,Ethical Hacking;Pentest;Audit de sécurité;Gestion des risques;Wireshark;SIEM;Kali Linux;Sécurité réseau;Facebook Ads,4,Bac+3 (Licence),"Profil Cybersécurité avec 4 ans d'expérience. Diplôme : Bac+3 (Licence). Compétences techniques maîtrisées : Ethical Hacking, Pentest, Audit de sécurité, Gestion des risques, Wireshark, SIEM, Kali Linux, Sécurité réseau, Facebook Ads. Domaine principal : Cybersécurité. Qualités personnelles : leadership, curiosité, créativité.",Marketing Digital,Stratégie digitale;Marketing Automation;Facebook Ads;Email Marketing,3,"Nous recherchons un profil Marketing Digital justifiant d'au moins 3 ans d'expérience. Compétences requises : Stratégie digitale, Marketing Automation, Facebook Ads, Email Marketing. Le candidat idéal maîtrise ces technologies et outils dans un contexte Marketing Digital.",64.4
Réseaux / Systèmes,VPN;Virtualisation;Cisco;Supervision réseau;Routage;VMware;DNS;Switching;PMP,3,Doctorat (PhD),"Amine - Doctorat (PhD) - 3 années d'expérience professionnelle en Réseaux / Systèmes. A travaillé pendant 3 ans sur des projets liés à Réseaux / Systèmes, en mettant en œuvre VPN, Virtualisation, Cisco, Supervision réseau, Routage, VMware, DNS, Switching, PMP. Qualités personnelles : leadership, sens de l'organisation, rigueur.",Réseaux / Systèmes,VPN;Cisco;Virtualisation;TCP/IP;DNS;Supervision réseau;PowerShell,5,"Nous recherchons un profil Réseaux / Systèmes justifiant d'au moins 5 ans d'expérience. Compétences requises : VPN, Cisco, Virtualisation, TCP/IP, DNS, Supervision réseau, PowerShell. Le candidat idéal maîtrise ces technologies et outils dans un contexte Réseaux / Systèmes.",70.47
Finance / Comptabilité,Reporting financier;Gestion des risques financiers;Audit financier;Budgétisation;Comptabilité générale;Fiscalité,5,Bac+2 (BTS/DUT),"Ahmed, Bac+2 (BTS/DUT), 5 ans d'expérience dans le domaine Finance / Comptabilité. A travaillé pendant 5 ans sur des projets liés à Finance / Comptabilité, en mettant en œuvre Reporting financier, Gestion des risques financiers, Audit financier, Budgétisation, Comptabilité générale, Fiscalité. Qualités personnelles : autonomie, leadership, curiosité.",Développement Logiciel,HTML;Node.js;CI/CD;PostgreSQL;Spring Boot;Java;SOLID,1,"Poste ouvert dans le domaine Développement Logiciel, 1 ans d'expérience minimum requis. Compétences requises : HTML, Node.js, CI/CD, PostgreSQL, Spring Boot, Java, SOLID. Le candidat idéal maîtrise ces technologies et outils dans un contexte Développement Logiciel.",54.67
Réseaux / Systèmes,VPN;PowerShell;Supervision réseau;Sécurité réseau,0,Bac+5 (Master / Ingénieur),"Salma, Bac+5 (Master / Ingénieur), 0 ans d'expérience dans le domaine Réseaux / Systèmes. Expérience professionnelle de 0 ans incluant l'utilisation de VPN, PowerShell, Supervision réseau, Sécurité réseau dans des projets Réseaux / Systèmes. Qualités personnelles : sens de l'organisation, adaptabilité, résolution de problèmes.",Réseaux / Systèmes,Supervision réseau;Routage;DHCP;VMware;Linux;VPN;Virtualisation;DNS,1,"Nous recherchons un profil Réseaux / Systèmes justifiant d'au moins 1 ans d'expérience. Compétences requises : Supervision réseau, Routage, DHCP, VMware, Linux, VPN, Virtualisation, DNS. Le candidat idéal maîtrise ces technologies et outils dans un contexte Réseaux / Systèmes.",14.5
DevOps / Cloud,Azure;Bash;Monitoring;Cloud Security;Docker;Networking;Ansible;Budgétisation,6,Bac+5 (Master / Ingénieur),"Rim - Bac+5 (Master / Ingénieur) - 6 années d'expérience professionnelle en DevOps / Cloud. A travaillé pendant 6 ans sur des projets liés à DevOps / Cloud, en mettant en œuvre Azure, Bash, Monitoring, Cloud Security, Docker, Networking, Ansible, Budgétisation. Qualités personnelles : résolution de problèmes, adaptabilité, créativité.",DevOps / Cloud,Helm;CI/CD;Prometheus;Grafana;Azure;Load Balancing;Nginx,7,"Nous recherchons un profil DevOps / Cloud justifiant d'au moins 7 ans d'expérience. Compétences requises : Helm, CI/CD, Prometheus, Grafana, Azure, Load Balancing, Nginx. Le candidat idéal maîtrise ces technologies et outils dans un contexte DevOps / Cloud.",50.29
Data Science / Intelligence Artificielle,Python;TensorFlow;MLOps;Data Warehousing,8,Doctorat (PhD),"Marwa - Doctorat (PhD) - 8 années d'expérience professionnelle en Data Science / Intelligence Artificielle. Compétences techniques maîtrisées : Python, TensorFlow, MLOps, Data Warehousing. Domaine principal : Data Science / Intelligence Artificielle. Qualités personnelles : communication, esprit d'équipe, rigueur.",Data Science / Intelligence Artificielle,Computer Vision;NLP;PyTorch;Keras;A/B Testing;Machine Learning,3,"Poste ouvert dans le domaine Data Science / Intelligence Artificielle, 3 ans d'expérience minimum requis. Compétences requises : Computer Vision, NLP, PyTorch, Keras, A/B Testing, Machine Learning. Le candidat idéal maîtrise ces technologies et outils dans un contexte Data Science / Intelligence Artificielle.",63.05
Design UI/UX,UI Design;Prototypage;Illustrator;Figma;Wireframing;Sketch;After Effects;Adobe XD;Motion Design;User Research,9,Bac+5 (Master / Ingénieur),"Candidat motivé, 9 ans d'expérience en Design UI/UX, Bac+5 (Master / Ingénieur). Expérience professionnelle de 9 ans incluant l'utilisation de UI Design, Prototypage, Illustrator, Figma, Wireframing, Sketch, After Effects, Adobe XD, Motion Design, User Research dans des projets Design UI/UX. Qualités personnelles : autonomie, gestion du stress, leadership.",DevOps / Cloud,Terraform;Docker;Cloud Security;AWS;Linux;Jenkins;Ansible;Grafana;Helm;Prometheus,7,"Poste ouvert dans le domaine DevOps / Cloud, 7 ans d'expérience minimum requis. Compétences requises : Terraform, Docker, Cloud Security, AWS, Linux, Jenkins, Ansible, Grafana, Helm, Prometheus. Le candidat idéal maîtrise ces technologies et outils dans un contexte DevOps / Cloud.",49.42
Ressources Humaines,Droit du travail;Entretien annuel;Workday;Formation professionnelle;Marque employeur;SIRH;Relations sociales;Onboarding;Paie;Gestion des talents;SOC monitoring,2,Bac+5 (Master / Ingénieur),"Profil Ressources Humaines avec 2 ans d'expérience. Diplôme : Bac+5 (Master / Ingénieur). Expérience professionnelle de 2 ans incluant l'utilisation de Droit du travail, Entretien annuel, Workday, Formation professionnelle, Marque employeur, SIRH, Relations sociales, Onboarding, Paie, Gestion des talents, SOC monitoring dans des projets Ressources Humaines. Qualités personnelles : esprit d'équipe, sens de l'organisation, communication.",Design UI/UX,UI Design;Wireframing;Adobe XD;Sketch;After Effects;Tests utilisateurs,0,"Nous recherchons un profil Design UI/UX justifiant d'au moins 0 ans d'expérience. Compétences requises : UI Design, Wireframing, Adobe XD, Sketch, After Effects, Tests utilisateurs. Le candidat idéal maîtrise ces technologies et outils dans un contexte Design UI/UX.",50.88
Cybersécurité,Kali Linux;OWASP;Firewall;Audit de sécurité;SOC monitoring,1,Bac+3 (Licence),"Emna - Bac+3 (Licence) - 1 années d'expérience professionnelle en Cybersécurité. Compétences techniques maîtrisées : Kali Linux, OWASP, Firewall, Audit de sécurité, SOC monitoring. Domaine principal : Cybersécurité. Qualités personnelles : esprit critique, résolution de problèmes, rigueur.",Cybersécurité,IAM;Incident Response;SOC monitoring;Cryptographie;SIEM;Gestion des risques;Wireshark;Firewall,1,"Offre d'emploi : spécialiste Cybersécurité, expérience minimale de 1 ans. Compétences requises : IAM, Incident Response, SOC monitoring, Cryptographie, SIEM, Gestion des risques, Wireshark, Firewall. Le candidat idéal maîtrise ces technologies et outils dans un contexte Cybersécurité.",54.84
Marketing Digital,HubSpot;Copywriting;Content Marketing;Marketing Automation;SEA;Stratégie digitale;Growth Hacking;SEO;Community Management;CRM;Réseaux sociaux;Email Marketing,6,Bac+5 (Master / Ingénieur),"Nour, Bac+5 (Master / Ingénieur), 6 ans d'expérience dans le domaine Marketing Digital. Expérience professionnelle de 6 ans incluant l'utilisation de HubSpot, Copywriting, Content Marketing, Marketing Automation, SEA, Stratégie digitale, Growth Hacking, SEO, Community Management, CRM, Réseaux sociaux, Email Marketing dans des projets Marketing Digital. Qualités personnelles : sens de l'organisation, curiosité, adaptabilité.",Marketing Digital,Growth Hacking;HubSpot;Google Analytics;Content Marketing;Google Ads,2,"Poste ouvert dans le domaine Marketing Digital, 2 ans d'expérience minimum requis. Compétences requises : Growth Hacking, HubSpot, Google Analytics, Content Marketing, Google Ads. Le candidat idéal maîtrise ces technologies et outils dans un contexte Marketing Digital.",80.27
Réseaux / Systèmes,Linux;Virtualisation;Supervision réseau;VMware;Switching;DHCP;TCP/IP;Routage;Active Directory;Cisco;PowerShell;Kali Linux,9,Bac+5 (Master / Ingénieur),"Molka, Bac+5 (Master / Ingénieur), 9 ans d'expérience dans le domaine Réseaux / Systèmes. A travaillé pendant 9 ans sur des projets liés à Réseaux / Systèmes, en mettant en œuvre Linux, Virtualisation, Supervision réseau, VMware, Switching, DHCP, TCP/IP, Routage, Active Directory, Cisco, PowerShell, Kali Linux. Qualités personnelles : rigueur, communication, résolution de problèmes.",Réseaux / Systèmes,Sécurité réseau;Switching;Linux;Routage,1,"Nous recherchons un profil Réseaux / Systèmes justifiant d'au moins 1 ans d'expérience. Compétences requises : Sécurité réseau, Switching, Linux, Routage. Le candidat idéal maîtrise ces technologies et outils dans un contexte Réseaux / Systèmes.",90.31
Réseaux / Systèmes,VPN;PowerShell;Active Directory;Sécurité réseau;Linux;Virtualisation;Switching;DHCP;VMware;TCP/IP;Cisco;Gestion des risques,4,Bac+3 (Licence),"Profil Réseaux / Systèmes avec 4 ans d'expérience. Diplôme : Bac+3 (Licence). Expérience professionnelle de 4 ans incluant l'utilisation de VPN, PowerShell, Active Directory, Sécurité réseau, Linux, Virtualisation, Switching, DHCP, VMware, TCP/IP, Cisco, Gestion des risques dans des projets Réseaux / Systèmes. Qualités personnelles : esprit critique, communication, gestion du stress.",Réseaux / Systèmes,Routage;VMware;DNS;Virtualisation;Cisco;TCP/IP;PowerShell,7,"Nous recherchons un profil Réseaux / Systèmes justifiant d'au moins 7 ans d'expérience. Compétences requises : Routage, VMware, DNS, Virtualisation, Cisco, TCP/IP, PowerShell. Le candidat idéal maîtrise ces technologies et outils dans un contexte Réseaux / Systèmes.",62.86
Ressources Humaines,Formation professionnelle;GPEC;Relations sociales;Onboarding;SIRH,8,Bac+2 (BTS/DUT),"Candidat motivé, 8 ans d'expérience en Ressources Humaines, Bac+2 (BTS/DUT). Expérience professionnelle de 8 ans incluant l'utilisation de Formation professionnelle, GPEC, Relations sociales, Onboarding, SIRH dans des projets Ressources Humaines. Qualités personnelles : communication, sens de l'organisation, esprit critique.",Ressources Humaines,Marque employeur;GPEC;Workday;Gestion des talents;Droit du travail,1,"Nous recherchons un profil Ressources Humaines justifiant d'au moins 1 ans d'expérience. Compétences requises : Marque employeur, GPEC, Workday, Gestion des talents, Droit du travail. Le candidat idéal maîtrise ces technologies et outils dans un contexte Ressources Humaines.",64.33
Finance / Comptabilité,SAP;Fiscalité;Comptabilité générale;Trésorerie;Consolidation;Reporting financier;Power BI;Audit financier;IFRS;Budgétisation,8,Bac+5 (Master / Ingénieur),"Nour - Bac+5 (Master / Ingénieur) - 8 années d'expérience professionnelle en Finance / Comptabilité. Expérience professionnelle de 8 ans incluant l'utilisation de SAP, Fiscalité, Comptabilité générale, Trésorerie, Consolidation, Reporting financier, Power BI, Audit financier, IFRS, Budgétisation dans des projets Finance / Comptabilité. Qualités personnelles : rigueur, créativité, esprit d'équipe.",Finance / Comptabilité,Modélisation financière;Reporting financier;Consolidation;Fiscalité;Contrôle de gestion,0,"Offre d'emploi : spécialiste Finance / Comptabilité, expérience minimale de 0 ans. Compétences requises : Modélisation financière, Reporting financier, Consolidation, Fiscalité, Contrôle de gestion. Le candidat idéal maîtrise ces technologies et outils dans un contexte Finance / Comptabilité.",73.92
Data Science / Intelligence Artificielle,scikit-learn;MLOps;Computer Vision;Spark;NLP;Tableau;Data Warehousing;Airflow,4,Doctorat (PhD),"Candidat motivé, 4 ans d'expérience en Data Science / Intelligence Artificielle, Doctorat (PhD). Compétences techniques maîtrisées : scikit-learn, MLOps, Computer Vision, Spark, NLP, Tableau, Data Warehousing, Airflow. Domaine principal : Data Science / Intelligence Artificielle. Qualités personnelles : gestion du stress, sens de l'organisation, autonomie.",Data Science / Intelligence Artificielle,Data Warehousing;Power BI;SQL;MLOps;R;Big Data,5,"Nous recherchons un profil Data Science / Intelligence Artificielle justifiant d'au moins 5 ans d'expérience. Compétences requises : Data Warehousing, Power BI, SQL, MLOps, R, Big Data. Le candidat idéal maîtrise ces technologies et outils dans un contexte Data Science / Intelligence Artificielle.",55.96
Réseaux / Systèmes,Linux;DHCP;Routage;Supervision réseau;Sécurité réseau;VPN,6,Bac+2 (BTS/DUT),"Molka, Bac+2 (BTS/DUT), 6 ans d'expérience dans le domaine Réseaux / Systèmes. A travaillé pendant 6 ans sur des projets liés à Réseaux / Systèmes, en mettant en œuvre Linux, DHCP, Routage, Supervision réseau, Sécurité réseau, VPN. Qualités personnelles : adaptabilité, résolution de problèmes, esprit critique.",Réseaux / Systèmes,PowerShell;Sécurité réseau;DHCP;Linux;Switching;Windows Server;Virtualisation;VMware,2,"Poste ouvert dans le domaine Réseaux / Systèmes, 2 ans d'expérience minimum requis. Compétences requises : PowerShell, Sécurité réseau, DHCP, Linux, Switching, Windows Server, Virtualisation, VMware. Le candidat idéal maîtrise ces technologies et outils dans un contexte Réseaux / Systèmes.",69.86
Data Science / Intelligence Artificielle,Tableau;Spark;ETL;TensorFlow;Deep Learning;scikit-learn,0,Bac+3 (Licence),"Salma, Bac+3 (Licence), 0 ans d'expérience dans le domaine Data Science / Intelligence Artificielle. A travaillé pendant 0 ans sur des projets liés à Data Science / Intelligence Artificielle, en mettant en œuvre Tableau, Spark, ETL, TensorFlow, Deep Learning, scikit-learn. Qualités personnelles : résolution de problèmes, curiosité, gestion du stress.",Gestion de Projet,Reporting projet;Agile;Budget projet;PMP,5,"Poste ouvert dans le domaine Gestion de Projet, 5 ans d'expérience minimum requis. Compétences requises : Reporting projet, Agile, Budget projet, PMP. Le candidat idéal maîtrise ces technologies et outils dans un contexte Gestion de Projet.",4.71
Réseaux / Systèmes,PowerShell;Sécurité réseau;Windows Server;Routage,8,Bac+5 (Master / Ingénieur),"Profil Réseaux / Systèmes avec 8 ans d'expérience. Diplôme : Bac+5 (Master / Ingénieur). A travaillé pendant 8 ans sur des projets liés à Réseaux / Systèmes, en mettant en œuvre PowerShell, Sécurité réseau, Windows Server, Routage. Qualités personnelles : sens de l'organisation, curiosité, créativité.",Réseaux / Systèmes,Active Directory;VPN;DNS;Switching;Supervision réseau;TCP/IP,1,"Poste ouvert dans le domaine Réseaux / Systèmes, 1 ans d'expérience minimum requis. Compétences requises : Active Directory, VPN, DNS, Switching, Supervision réseau, TCP/IP. Le candidat idéal maîtrise ces technologies et outils dans un contexte Réseaux / Systèmes.",53.0
Data Science / Intelligence Artificielle,Data Warehousing;Airflow;Data Visualization;Python,5,Bac+5 (Master / Ingénieur),"Sami - Bac+5 (Master / Ingénieur) - 5 années d'expérience professionnelle en Data Science / Intelligence Artificielle. A travaillé pendant 5 ans sur des projets liés à Data Science / Intelligence Artificielle, en mettant en œuvre Data Warehousing, Airflow, Data Visualization, Python. Qualités personnelles : autonomie, esprit critique, leadership.",Data Science / Intelligence Artificielle,TensorFlow;ETL;R;NumPy;Airflow;Deep Learning;Python;A/B Testing;Statistiques,1,"Offre d'emploi : spécialiste Data Science / Intelligence Artificielle, expérience minimale de 1 ans. Compétences requises : TensorFlow, ETL, R, NumPy, Airflow, Deep Learning, Python, A/B Testing, Statistiques. Le candidat idéal maîtrise ces technologies et outils dans un contexte Data Science / Intelligence Artificielle.",57.79
